lemma	derivation	category	cluster_id	senses
yoga	yo/ga	praatipadika	2	Yoga personified; a follower of the Yoga system; rite conducive to Yoga
yoga	yo/ga	praatipadika	3	a constellation
yoga	yo/ga	praatipadika	4	a supernatural means; fraud
yoga	yo/ga	praatipadika	5	a violator of confidence; abstract meditation; acquiesce in anything; any simple act; asterism; at the end of a compound in consequence of; cure; employment; exertion; fitness; meditation; mental abstraction practised as a system; mixing of various materials; mixing with the outer world; pious seeking after God; principal star of a lunar asterism; profit; regular succession; the act of yoking; the union of the individual soul with the universal soul; wealth
yoga	yo/ga	praatipadika	6	arraying
yoga	yo/ga	praatipadika	7	a means; a remedy; abstract contemplation; any junction; aphorism; by reason of; connection; consent; construction; contact with; conveyance; deceit; etymological meaning; fitting together; gain; harnessing; joining; lucky conjuncture; mixture; property; propriety; putting on; putting to; putting together; suitability; syntactical dependence of a word; team; the connection of a word with its root; the connection of words together; the leading; the union of soul with matter; union; vehicle
yoga	yo/ga	praatipadika	8	a combined; a trick; a yoke; according to; acquisition; addition; application; arrangement; attaching; attention; business; care; charm; combination; concentrated grammatical rule; concentration of the thoughts; conjunction; contact; device; devotion; diligence; disposition; endeavour; equipping; expedient; fixing; incantation; industry; magical art; manner; method; occasion; on account of; opportunity; original; partaking of; performance; possessing; relation; self-concentration; spy; stratagem; sum; through; to agree; total; undertaking; use; way; work; zeal
yuj	yu/j	dhaatu	0	a pair; a yoke-fellow; affected by; associate; being in couples; couple; drawn by; dual; pairs; possessed of; the two Aśvins
yuj	yuj	dhaatu	0	accomplish; add; adjust; apply; arrange; attack; be absorbed in meditation; be fitted for; belong to; bring or put together; bring together; carry on; combine; concentrate; conjunction with; connect; deserve to be; devout; direct; draw up; embrace; employ; endow with; enjoin; fit out; fix; furnish; harnessed; help to; inject; insert; join; joined; not to be fit; perform; possessed of; prepare; prepared for; proper; proper for; provide with; recall; repair; restore; right; set to work; suit any one; suit anything; suitable; to accrue to; to aim at; to appoint or to charge or intrust with; to attach one's self to; to be fit; to be made ready; to be united in marriage; to bring into possession of; to come into union; to command; to concentrate the mind in order to obtain union with the Universal Spirit; to confer; to confer anything upon; to encompass; to endow; to equip; to fasten on; to fix in; to harness; to join; to join one's self to; to lead towards; to make ready; to mix with; to offer; to put in order; to set; to turn; to use; to wish to appoint or institute; to wish to be absorbed in meditation; to wish to fix or aim; to wish to harness; undertake; unite; use; yoke with
yuj	yu/j	dhaatu	1	a sage who devotes his time to abstract contemplation
yuj	yuj	dhaatu	1	bestow anything upon; despise; esteem lightly; fall to the lot of; impel to; put to; to be endowed with; to be yoked; to come into conjunction with; to put on; to recollect; to think little of; to urge; yoke
yuj	yu/j	dhaatu	2	an exciter; bestowing; companion; comrade; even; exciting; furnished or provided or filled with; granting; harnessed; joined; the number two; yoked
yuj	yuj	dhaatu	2	to ascertain or know the conjunction of the moon with an asterism
yuj	yu/j	dhaatu	3	the zodiacal sign Gemini
