lemma	derivation	category	cluster_id	LaBSE	MPnet	Para-Mini	Qwen	VyA
grah	grah	dhaatu	4	to acquire by purchase	give away a girl in marriage to any one; obtain; receive; to accept; to acquire by purchase; to cause to marry; to choose; to choose any one as a wife; to make any one choose; to receive hospitably	accept; approve; obtain; pick; receive; to accept; to acquire by purchase; to calculate; to collect a store of anything; to gain; to receive hospitably; win	put on; receive; to accept; to assume; to be meant by; to desire to perceive; to obey; to observe; to perceive; to place upon; to receive hospitably; to receive into the mind	begin; draw water; follow; grasp; keep; lay hold of; pick; put on; seize; take; take away; to lay the hand on; to pluck; undergo; undertake
grah	grah	dhaatu	5	strive to apprehend; to be about to eclipse; to be about to seize; to desire to perceive; to eclipse	learn; strive to apprehend; to abstract; to assume; to calculate; to desire to perceive; to gain; to make any one learn; to obey; to observe; to perceive; to receive into the mind; understand		to choose; to choose any one as a wife; to make any one choose; to make any one learn	
grah	grah	dhaatu	6	to collect a store of anything			accept; admit; approve; begin; claim; consider as; familiar with; follow; gather; keep; learn; make acquainted; mention; name; observe; pick; recognise; to abstract; to collect a store of anything; to include; to use; undergo; understand; win	
grah	grah	dhaatu	7	give away a girl in marriage to any one; to cause any one to be captured; to cause any one to be seized; to cause to marry; to cause to take; to choose; to choose any one as a wife; to make any one choose; to make any one learn			to take into the mouth	
grah	grah	dhaatu	8	follow; keep; observe; to obey; to observe; undergo				
grah	grah	dhaatu	9	begin; claim; consider as; mention; put on; to assume; to be about to take away; to be meant by; to calculate; to include; to lay the hand on; to place upon; to take for; to take into the mouth; to take on one's self; to take up; to use; undertake				
grah	grah	dhaatu	10	accept; admit; approve; familiar with; learn; make acquainted; receive; recognise; to accept; to perceive; to receive hospitably; to receive into the mind; understand				
han	han	dhaatu	0	a killer; killing; slayer	a killer; killing; slayer	a killer; killing; slayer	a killer; killing; slayer	a killer; killing; slayer
han	han	naama-dhaatu	0	abandon; avert; give up; hinder; mar; to dispel; to mar; to obstruct; to repress; to smite; to strike off; to ward off	avert; hinder; to dispel; to hurl upon; to hurt; to obstruct; to repress; to smite; to ward off	abandon; avert; come into contact; give up; hammer; hinder; mar; pound; slay; to dispel; to hurl upon; to mar; to obstruct; to repress; to slay; to smite; to ward off	abandon; avert; destroy; give up; to dispel; to obstruct; to repress; to strike off; to ward off	beat; come into contact; hammer; hit; mar; pound; slay; to mar; to slay; to smite; to touch
han	han	naama-dhaatu	1	cause to be executed; destroy; kill; killed; punish; put to death; slay; to cause to be slain; to put to death; to slay; to wish to kill	abandon; give up; mar; to mar	cause to be executed; destroy; kill; killed; punish; put to death; to cause to be slain; to notify a person's death; to put to death; to wish to kill	cause to be executed	abandon; avert; destroy; give up; hinder; to dispel; to obstruct; to repress; to ward off
han	han	naama-dhaatu	2	pound	cause to be executed; destroy; kill; killed; punish; put to death; slay; to cause to be slain; to notify a person's death; to put to death; to slay; to wish to kill	beat; hit; injure; strike upon; to be struck; to hurt; to strike; to strike off; to strike or tread upon; to touch; wound	beat; come into contact; hammer; hinder; hit; injure; mar; punish; strike upon; to be struck; to hurl upon; to hurt; to mar; to smite; to strike; to strike or tread upon; to touch; wound	cause to be executed; kill; killed; punish; put to death; to cause to be slain; to notify a person's death; to put to death; to wish to kill
han	han	naama-dhaatu	3	to notify a person's death	beat; come into contact; hammer; hit; injure; pound; strike upon; to be struck; to strike; to strike off; to strike or tread upon; to touch; wound		kill; killed; put to death; slay; to cause to be slain; to notify a person's death; to put to death; to slay; to wish to kill	injure; to hurt; wound
han	han	naama-dhaatu	4	beat; come into contact; hammer; hit; injure; strike upon; to be struck; to hurl upon; to hurt; to strike; to strike or tread upon; to touch; wound			pound	strike upon; to be struck; to hurl upon; to strike; to strike off; to strike or tread upon
hari	ha/ri	praatipadika	0	Name of Brahmā; Name of Indra; Name of Suparṇa; Name of Vāyu; Name of Yama; Name of a Dānava; Name of a Rākṣasa; Name of a metre; Name of a mountain; Name of a world; Name of Śiva; Name of Śukra	Name of a metre; Name of a mountain; Name of a particular high number; Name of a world; a ray of light; fire; the moon; the sun; the wind	Name of a metre; Name of a particular high number	Name of a metre	Name of a particular high number; Name of various authors
hari	hari	praatipadika	0	an exclamation	an exclamation	an exclamation	an exclamation	an exclamation
hari	ha/ri	praatipadika	1	Name of a particular high number	Name of Brahmā; Name of Indra; Name of Suparṇa; Name of Viṣṇu-Kṛṣṇa; Name of Vāyu; Name of Yama; Name of a Dānava; Name of a Rākṣasa; Name of a son of Akampana; Name of a son of Garuḍa; Name of a son of Parājit; Name of a son of Parāvṛt; Name of a son of Tārakākṣa; Name of a worshipper of Viṣṇu; Name of Śiva; Name of Śukra; a particular class of gods under Manu Tāmasa	Name of a world	Name of a mountain	Name of a son of Akampana; Name of a son of Garuḍa; Name of a son of Parājit; Name of a son of Parāvṛt; Name of a son of Tārakākṣa
hari	hari	praatipadika	1	bearing; carrying	bearing; carrying	bearing; carrying	bearing; carrying	bearing; carrying
hari	ha/ri	praatipadika	2	Name of a son of Akampana; Name of a son of Garuḍa; Name of a son of Parājit; Name of a son of Parāvṛt; Name of a son of Tārakākṣa	Name of various authors; scholars	Name of Brahmā; Name of Indra; Name of Suparṇa; Name of Viṣṇu-Kṛṣṇa; Name of Vāyu; Name of Yama; Name of a Dānava; Name of a Rākṣasa; Name of a mountain; Name of a son of Akampana; Name of a son of Garuḍa; Name of a son of Parājit; Name of a son of Parāvṛt; Name of a son of Tārakākṣa; Name of a worshipper of Viṣṇu; Name of Śiva; Name of Śukra; a particular class of gods under Manu Tāmasa	Name of a particular high number	Name of Brahmā; Name of Indra; Name of Suparṇa; Name of Viṣṇu-Kṛṣṇa; Name of Vāyu; Name of Yama; Name of a Dānava; Name of a Rākṣasa; Name of a metre; Name of a mountain; Name of a world; Name of a worshipper of Viṣṇu; Name of Śiva; Name of Śukra
hari	ha/ri	praatipadika	3	Name of Viṣṇu-Kṛṣṇa; Name of a worshipper of Viṣṇu	Phaseolus Mungo; a frog; a goose; a horse; a jackal; a lion; a monkey; a parrot; a peacock; a snake; steed; the Koil or Indian cuckoo	a horse	Name of a son of Akampana; Name of a son of Parājit; Name of a son of Parāvṛt; Name of a son of Tārakākṣa	Phaseolus Mungo
hari	ha/ri	praatipadika	4	Name of various authors	bay; brown; fallow; fawn-coloured; green; greenish; pale yellow; reddish brown; tawny; yellow	a frog; a goose; a lion; a monkey; a parrot; a peacock; a snake; the Koil or Indian cuckoo	Name of a world	a horse
hari	ha/ri	praatipadika	5	Phaseolus Mungo	men; people	Name of various authors; Phaseolus Mungo; a jackal; bay; fallow; fire; men; people; scholars; steed; tawny	Name of Brahmā; Name of Indra; Name of Suparṇa; Name of Viṣṇu-Kṛṣṇa; Name of Vāyu; Name of Yama; Name of a Dānava; Name of a Rākṣasa; Name of a son of Garuḍa; Name of a worshipper of Viṣṇu; Name of Śiva; Name of Śukra	a frog; a goose; a jackal; a lion; a monkey; a parrot; a peacock; a snake
hari	ha/ri	praatipadika	6	a frog; a goose; a horse; a jackal; a lion; a monkey; a parrot; a peacock; a snake; steed	the sign of the zodiac Leo	a ray of light; brown; fawn-coloured; green; greenish; pale yellow; reddish brown; the moon; the sign of the zodiac Leo; the sun; the wind; yellow	Name of various authors	a particular class of gods under Manu Tāmasa
hari	ha/ri	praatipadika	7	a particular class of gods under Manu Tāmasa			Phaseolus Mungo	fire
hari	ha/ri	praatipadika	8	a ray of light			a frog; a goose; a horse; a jackal; a lion; a monkey; a parrot; a peacock; a snake; steed; the Koil or Indian cuckoo; the sign of the zodiac Leo	bay; brown; fallow; fawn-coloured; green; greenish; pale yellow; reddish brown; steed; tawny; yellow
hari	ha/ri	praatipadika	9	bay			a particular class of gods under Manu Tāmasa	men; people
hari	ha/ri	praatipadika	10	fallow			a ray of light	scholars
hari	ha/ri	praatipadika	11	fire			brown; fallow; fawn-coloured; green; greenish; pale yellow; reddish brown; tawny; yellow	the Koil or Indian cuckoo
hari	ha/ri	praatipadika	12	brown; fawn-coloured; green; greenish; pale yellow; reddish brown; yellow			men; people	the moon
hari	ha/ri	praatipadika	13	men; people			scholars	the sign of the zodiac Leo
hari	ha/ri	praatipadika	14	scholars			bay; fire; the moon; the sun; the wind	a ray of light; the sun
hari	ha/ri	praatipadika	15	tawny				the wind
hari	ha/ri	praatipadika	16	the Koil or Indian cuckoo				
hari	ha/ri	praatipadika	17	the sign of the zodiac Leo				
hari	ha/ri	praatipadika	18	the moon; the sun				
hari	ha/ri	praatipadika	19	the wind				
hi	hi	dhaatu	0	abandon; bring; get rid of; procure; to convey; to discharge; to forsake; to send forth	abandon; get rid of; hurl; impel; shoot; to forsake	cast	abandon; get rid of; to discharge; to forsake; to send forth	cast; hasten on; hurl; impel; set in motion; shoot
hi	hi/	avyaya	0	do	just	do; just	do; just; pray	do; just
hi	hi/	dhaatu	0	an interjection of envy and contempt and hurry	assuredly; certainly; most assuredly; of course; surely	assuredly; because; certainly; for; indeed; most assuredly; of course; on account of; surely	an interjection of envy and contempt and hurry	an interjection of envy and contempt and hurry
hi	hi	dhaatu	1	cast; hurl; shoot	cast	bring; delight; hasten on; hurl; impel; procure; set in motion; shoot; to gladden	hasten on; hurl; impel; incite to; set in motion; shoot; to stimulate; urge on	abandon; delight; get rid of; to discharge; to forsake; to gladden
hi	hi/	avyaya	1	just	do; pray	pray		pray
hi	hi/	dhaatu	1	assuredly; certainly; indeed; indeed-but; most assuredly; of course; surely	because; on account of	especially to avoid a hiatus	assuredly; certainly; indeed; indeed-but; most assuredly; of course; surely	assuredly; certainly; indeed; most assuredly; of course; surely
hi	hi	dhaatu	2	delight; to gladden	bring; delight; help to; procure; set in motion; to assist; to convey; to discharge; to gladden; to send forth; to stimulate	help to; incite to; to assist; to convey; to discharge; to send forth; to stimulate; urge on	bring; cast; delight; help to; procure; to assist; to convey; to gladden	bring; help to; incite to; procure; to assist; to convey; to send forth; to stimulate; urge on
hi	hi/	avyaya	2	pray				
hi	hi/	dhaatu	2	because; for; on account of	especially to avoid a hiatus	an interjection of envy and contempt and hurry; indeed-but; often a mere expletive; sometimes repeated in the same sentence	because; for; on account of	especially to avoid a hiatus
hi	hi	dhaatu	3	help to; to assist	hasten on; incite to; urge on	abandon; get rid of; to forsake		
hi	hi/	dhaatu	3	especially to avoid a hiatus	for		especially to avoid a hiatus	often a mere expletive; sometimes repeated in the same sentence
hi	hi	dhaatu	4	hasten on; impel; incite to; set in motion; to stimulate; urge on				
hi	hi/	dhaatu	4	often a mere expletive	indeed; indeed-but		often a mere expletive	because; for; indeed-but; on account of
hi	hi/	dhaatu	5	sometimes repeated in the same sentence	an interjection of envy and contempt and hurry; often a mere expletive		sometimes repeated in the same sentence	
hi	hi/	dhaatu	6		sometimes repeated in the same sentence			
kAla	kAla	praatipadika	0	Name of Rudra; Name of a Nāga-rāja; Name of a Rakṣas	Name of Rudra; Name of a Nāga-rāja; Name of a Rakṣas; Name of a brother of king Prasena-jit; Name of a future Buddha; Name of a son of Hrada; Name of an author of Mantras; Name of an enemy of Śiva; Name of Śiva; of the prince Kāla-yavana; the poisonous serpent Coluber Naga	Name of Rudra; Name of a Nāga-rāja; Name of a Rakṣas; Name of a brother of king Prasena-jit; Name of a future Buddha; Name of a mountain; Name of a son of Hrada; Name of an author of Mantras; Name of an enemy of Śiva; Name of Śiva; a mystical Name of the letter; of one of the nine treasures; of the prince Kāla-yavana	Name of Rudra; Name of a Nāga-rāja; Name of a Rakṣas; Name of a future Buddha; Name of an enemy of Śiva; Name of Śiva; a mystical Name of the letter; the poisonous serpent Coluber Naga	Name of Rudra; Name of a Nāga-rāja; Name of a Rakṣas; Name of a brother of king Prasena-jit; Name of a future Buddha; Name of a mountain; Name of a son of Hrada; Name of an author of Mantras; Name of an enemy of Śiva; Name of Śiva; a mystical Name of the letter; of the prince Kāla-yavana
kAla	kAla/	praatipadika	0	a fixed	a fixed	death; death by age; destiny; fate; the end; time of death	a fixed	death; death by age; the end; time of death
kAla	kAla	praatipadika	1	Name of a brother of king Prasena-jit	Name of a mountain; a mystical Name of the letter; of one of the nine treasures	a black; a black kind of Agallochum; a kind of perfume; black; dark-blue; dark-blue colour; of a dark colour; the black part of the eye	Name of a brother of king Prasena-jit	a kind of perfume
kAla	kAla/	praatipadika	1	circumstance; destiny; fate; occasion; season; season for	circumstance; death; death by age; destiny; fate; occasion; the end	a fixed; a section; circumstance; occasion; part; prosody	circumstance; occasion	a fixed; a section; circumstance; destiny; fate; occasion; part; prosody; season; season for
kAla	kAla	praatipadika	2	Name of a future Buddha	a black; a black kind of Agallochum; a kind of perfume; a red kind of Plumbago; black; dark-blue; dark-blue colour; of a dark colour; the black part of the eye	iron	Name of a mountain	a red kind of Plumbago
kAla	kAla/	praatipadika	2	a section; part	prosody	season; season for	death; death by age; the end; time of death	a period of time; a space of time; hour; meal-time; measure of time; right point of time; the proper time; time; time of the world
kAla	kAla	praatipadika	3	Name of a mountain	iron	a red kind of Plumbago; the Indian cuckoo; the poisonous serpent Coluber Naga	Name of a son of Hrada	a black; a black kind of Agallochum; black; dark-blue; dark-blue colour; of a dark colour; the black part of the eye
kAla	kAla/	praatipadika	3	prosody	season; season for	a period of time; a space of time; hour; meal-time; measure of time; right point of time; the proper time; time; time of the world	destiny	
kAla	kAla	praatipadika	4	Name of a son of Hrada	the Indian cuckoo	the planet Saturn	Name of an author of Mantras	iron
kAla	kAla/	praatipadika	4	the end	a period of time; a section; a space of time; hour; meal-time; measure of time; part; right point of time; the proper time; time; time of death; time of the world		fate	
kAla	kAla	praatipadika	5	Name of an author of Mantras	the planet Saturn	the plant Cassia Sophora; the resin of the plant Shorea robusta	a kind of perfume	of one of the nine treasures
kAla	kAla/	praatipadika	5	a period of time; a space of time; hour; meal-time; measure of time; right point of time; the proper time; time; time of the world			meal-time	
kAla	kAla	praatipadika	6	Name of an enemy of Śiva; Name of Śiva	the plant Cassia Sophora; the resin of the plant Shorea robusta		a black; a black kind of Agallochum; black; dark-blue; dark-blue colour; of a dark colour; the black part of the eye	the Indian cuckoo
kAla	kAla/	praatipadika	6	death; death by age; time of death			a section; part	
kAla	kAla	praatipadika	7	a black kind of Agallochum			iron	the planet Saturn
kAla	kAla/	praatipadika	7				prosody	
kAla	kAla	praatipadika	8	a kind of perfume			of one of the nine treasures	the plant Cassia Sophora
kAla	kAla/	praatipadika	8				season; season for	
kAla	kAla	praatipadika	9	a mystical Name of the letter			of the prince Kāla-yavana	the poisonous serpent Coluber Naga
kAla	kAla/	praatipadika	9				a period of time; a space of time; hour; measure of time; right point of time; the proper time; time; time of the world	
kAla	kAla	praatipadika	10	a red kind of Plumbago			the Indian cuckoo	the resin of the plant Shorea robusta
kAla	kAla	praatipadika	11	a black; black; dark-blue; dark-blue colour; of a dark colour; the black part of the eye			the planet Saturn	
kAla	kAla	praatipadika	12	iron			a red kind of Plumbago; the plant Cassia Sophora; the resin of the plant Shorea robusta	
kAla	kAla	praatipadika	13	of one of the nine treasures				
kAla	kAla	praatipadika	14	of the prince Kāla-yavana				
kAla	kAla	praatipadika	15	the Indian cuckoo				
kAla	kAla	praatipadika	16	the planet Saturn				
kAla	kAla	praatipadika	17	the plant Cassia Sophora				
kAla	kAla	praatipadika	18	the poisonous serpent Coluber Naga				
kAla	kAla	praatipadika	19	the resin of the plant Shorea robusta				
karman	ka/rman	praatipadika	0	act; action; action consisting in motion; activity; rite	act; action; action consisting in motion; activity; any religious act	action; action consisting in motion; activity; calculation; effect; performance; physicking; product; result	act; action; action consisting in motion; activity; former act as leading to inevitable results	act; action; action consisting in motion; activity; performance
karman	ka/rman	praatipadika	1	any religious act	calculation; effect; fate; former act as leading to inevitable results; performance; product; result	medical attendance	any religious act	any religious act
karman	ka/rman	praatipadika	2	calculation	medical attendance	business; labour; occupation; office; work	calculation	business
karman	ka/rman	praatipadika	3	fate	business; labour; obligation; occupation; office; special duty; work	act; any religious act; fate; former act as leading to inevitable results; obligation; organ of sense; rite; special duty; the object	fate	medical attendance
karman	ka/rman	praatipadika	4	former act as leading to inevitable results	physicking	the tenth lunar mansion	medical attendance	office
karman	ka/rman	praatipadika	5	medical attendance	rite		obligation	physicking
karman	ka/rman	praatipadika	6	organ of sense	organ of sense; the object		business; labour; occupation; office; work	effect; fate; former act as leading to inevitable results; result
karman	ka/rman	praatipadika	7	physicking	the tenth lunar mansion		organ of sense	obligation; special duty
karman	ka/rman	praatipadika	8	effect; performance; product; result; the object			physicking	organ of sense; product; the object
karman	ka/rman	praatipadika	9	special duty			product	the tenth lunar mansion
karman	ka/rman	praatipadika	10	the tenth lunar mansion			effect; performance; result; rite	calculation; labour; occupation; rite; work
karman	ka/rman	praatipadika	11	business; labour; obligation; occupation; office; work			special duty	
karman	ka/rman	praatipadika	12				the object	
karman	ka/rman	praatipadika	13				the tenth lunar mansion	
kavi	kav	praatipadika	0	Name of Agni; Name of Indra; Name of the Aśvins	Name of Agni; Name of Indra; Name of Maruts; Name of Varuṇa; Name of several gods; Name of the Aśvins; Name of Ādityas	Name of Agni; Name of Indra; Name of Maruts; Name of Varuṇa; Name of the Aśvins; Name of Ādityas	Name of Agni; Name of Indra; Name of Maruts; Name of Varuṇa; Name of several gods; Name of the Aśvins; Name of Ādityas	Name of Agni; Name of Indra; Name of Maruts; Name of Varuṇa; Name of several gods; Name of the Aśvins; Name of Ādityas
kavi	kavi/	praatipadika	0	Name of a particular poet	Name of a particular poet	Name of the gates of the sacrificial enclosure	Name of a particular poet	Name of Brahmā; Name of Pūṣan; Name of Vālmīki; Name of a son of Bhṛgu; Name of a son of Brahmā; Name of a son of Kauśika; Name of a son of Ṛṣabha; Name of the Soma; Name of the Soma priest; Name of the Ṛbhus; Name of Śukra; father of Śukra
kavi	kav	praatipadika	1	Name of Maruts; Name of Ādityas	a singer; a wise man; bard; poet; prophet; sage; seer	Name of several gods; a singer; a wise man; bard; poet; prophet; sage; seer	a singer	a singer
kavi	kavi/	praatipadika	1	Name of ancient patriarchs; Name of the ancient sages	Name of Brahmā; Name of Pūṣan; Name of Vālmīki; Name of a son of Bhṛgu; Name of a son of Brahmā; Name of a son of Kauśika; Name of a son of Ṛṣabha; Name of ancient patriarchs; Name of other sacrificers; Name of the Soma; Name of the Soma priest; Name of the ancient sages; Name of the gates of the sacrificial enclosure; Name of the sons of several Manus; Name of the Ṛbhus; Name of Śukra; father of Śukra; the soul in the Sāṃkhya philosophy	Name of the planet Venus	Name of ancient patriarchs; Name of other sacrificers; Name of the Soma; Name of the Soma priest; Name of the ancient sages; Name of the gates of the sacrificial enclosure	Name of the gates of the sacrificial enclosure
kavi	kav	praatipadika	2	Name of Varuṇa			a wise man	a wise man
kavi	kavi/	praatipadika	2	Name of other sacrificers	Name of the planet Venus	Name of Brahmā; Name of Pūṣan; Name of Vālmīki; Name of a particular poet; Name of a son of Bhṛgu; Name of a son of Brahmā; Name of a son of Kauśika; Name of a son of Ṛṣabha; Name of ancient patriarchs; Name of other sacrificers; Name of the Soma; Name of the Soma priest; Name of the ancient sages; Name of the sons of several Manus; Name of the Ṛbhus; Name of Śukra; father of Śukra; of various men; the soul in the Sāṃkhya philosophy	Name of the planet Venus	Name of the planet Venus
kavi	kav	praatipadika	3	Name of several gods			bard; seer	bard; poet
kavi	kavi/	praatipadika	3	Name of Brahmā; Name of Pūṣan; Name of Vālmīki; Name of a son of Bhṛgu; Name of a son of Brahmā; Name of a son of Kauśika; Name of a son of Ṛṣabha; Name of the Soma; Name of the Soma priest; Name of the Ṛbhus	a keeper; a ladle; an owl; leader; the bit of a bridle; the reins	an owl	a ladle	Name of a particular poet; Name of ancient patriarchs; Name of other sacrificers; Name of the ancient sages; Name of the sons of several Manus
kavi	kav	praatipadika	4	a singer; bard; poet; prophet			poet	prophet
kavi	kavi/	praatipadika	4	Name of the gates of the sacrificial enclosure	herd	a cunning fighter; a keeper; a ladle; a thinker; cunning; enlightened; gifted with insight; herd; intelligent; intelligent man; knowing; leader; man of understanding; prudent; pupil of Garga; sensible; skilful; the bit of a bridle; the reins; the sun; wise	an owl	a keeper
kavi	kav	praatipadika	5	a wise man; sage			prophet	sage; seer
kavi	kavi/	praatipadika	5	Name of the planet Venus	a cunning fighter; a thinker; cunning; enlightened; gifted with insight; intelligent; intelligent man; knowing; man of understanding; of various men; prudent; sensible; skilful; wise		a cunning fighter; a keeper; leader	a ladle; the bit of a bridle; the reins
kavi	kav	praatipadika	6	seer			sage	
kavi	kavi/	praatipadika	6	Name of the sons of several Manus	pupil of Garga		of various men	a thinker
kavi	kavi/	praatipadika	7	Name of Śukra; father of Śukra	the sun		a thinker; cunning; enlightened; gifted with insight; intelligent; intelligent man; knowing; man of understanding; prudent; sensible; skilful; wise	an owl
kavi	kavi/	praatipadika	8	a cunning fighter			Name of Brahmā; Name of Pūṣan; Name of Vālmīki; Name of a son of Bhṛgu; Name of a son of Brahmā; Name of a son of Kauśika; Name of a son of Ṛṣabha; Name of the sons of several Manus; Name of the Ṛbhus; Name of Śukra; father of Śukra; pupil of Garga	herd
kavi	kavi/	praatipadika	9	a keeper; a ladle; an owl			herd; the bit of a bridle; the reins	leader
kavi	kavi/	praatipadika	10	herd			the soul in the Sāṃkhya philosophy	of various men
kavi	kavi/	praatipadika	11	cunning; enlightened; gifted with insight; intelligent; knowing; prudent; sensible; skilful; wise			the sun	pupil of Garga
kavi	kavi/	praatipadika	12	leader				a cunning fighter; cunning; enlightened; gifted with insight; intelligent; intelligent man; knowing; man of understanding; prudent; sensible; skilful; wise
kavi	kavi/	praatipadika	13	a thinker; intelligent man; man of understanding				the soul in the Sāṃkhya philosophy
kavi	kavi/	praatipadika	14	of various men				the sun
kavi	kavi/	praatipadika	15	pupil of Garga				
kavi	kavi/	praatipadika	16	the bit of a bridle				
kavi	kavi/	praatipadika	17	the reins				
kavi	kavi/	praatipadika	18	the soul in the Sāṃkhya philosophy				
kavi	kavi/	praatipadika	19	the sun				
kf	kf	dhaatu	0	a fog	a fog	a fog	a fog	a fog
kf	kf	dhaatu	1	being done	being done	being done	being done	being done
kf	kf	dhaatu	2	to injure	to injure	to injure	to injure	to injure
mad	mad	dhaatu	0	animate; be drunk with; exhilarate; inflame; inspire; intoxicate; to boil	base of the first person pronoun in the singular number number	animate; at ease; exult; inspire; revel in; satisfy; to gladden; to tarry	animate; bubble	base of the first person pronoun in the singular number number
