lemma	derivation	category	cluster_id	LaBSE	MPnet	Para-Mini	Qwen	VyA
brahman	brahma/n	praatipadika	2	Name of the 9th Muhūrta	Name of Bṛhas-pati; Name of a star; Name of the 9th Muhūrta; Name of the servant of the 10th Arhat of the present Avasarpiṇī; Name of Śiva; a particular Kalpa; a particular astronomy Yoga; the Veda; the intellect; the sun	Name of a star; a particular astronomy Yoga; the sun	Name of the 9th Muhūrta	a Brāhman who is a knower of Vedic texts; a devout; one versed in sacred knowledge; one who prays; religious man
brahman	bra/hman	praatipadika	3	final emancipation	one self-existent impersonal Spirit; the Absolute; the Eternal; the Self-existent; the one universal Soul	final emancipation; one self-existent impersonal Spirit; the Absolute; the Eternal; the Self-existent; the one universal Soul	food	one self-existent impersonal Spirit; pious effusion; the Absolute; the Eternal; the Self-existent; the one universal Soul
brahman	brahma/n	praatipadika	3	Name of the servant of the 10th Arhat of the present Avasarpiṇī	a devout; as the first of the triad of personal gods; one of the 4 principal priests; one versed in sacred knowledge; one who prays; religious man; the one impersonal universal Spirit manifested as a personal Creator		Name of the servant of the 10th Arhat of the present Avasarpiṇī	a particular Kalpa
brahman	bra/hman	praatipadika	4	food	communicators of sacred knowledge; the Brahmă; the Brāhmanical caste as a body; the Brāhmaṇa portion of the Veda; the Veda; the class of men who are the repositories	the Brahmă; the Brāhmanical caste as a body; the Brāhmaṇa portion of the Veda; the Veda	one self-existent impersonal Spirit; the Absolute; the Eternal; the Self-existent; the one universal Soul	outpouring of the heart in worshipping the gods
brahman	brahma/n	praatipadika	4	Name of Śiva	δ Aurigae		a Brāhman who is a knower of Vedic texts; an inhabitant of Brahmā's heaven; one of the 4 principal priests; one versed in sacred knowledge	a particular astronomy Yoga
brahman	bra/hman	praatipadika	5	one self-existent impersonal Spirit; the one universal Soul	Mantra used as a spell; a sacred text; a text; outpouring of the heart in worshipping the gods; the sacred syllable Om; the sacred word; utterance	the class of men who are the repositories	outpouring of the heart in worshipping the gods; pious effusion	the Brahmă; the Brāhmaṇa portion of the Veda; the Veda
brahman	brahma/n	praatipadika	5	a Brāhman who is a knower of Vedic texts	Ṛtvijas		a devout; one who prays; religious man	as the first of the triad of personal gods
brahman	bra/hman	praatipadika	6	outpouring of the heart in worshipping the gods		wealth	prayer	the Brāhmanical caste as a body
brahman	brahma/n	praatipadika	6	a devout; one who prays; religious man			a lifetime of Brahmā; a particular Kalpa	one of the 4 principal priests
brahman	bra/hman	praatipadika	7	pious effusion			spiritual knowledge	the class of men who are the repositories
brahman	brahma/n	praatipadika	7	Brahmā; a lifetime of Brahmā; an inhabitant of Brahmā's heaven			a particular astronomy Yoga	the intellect
brahman	bra/hman	praatipadika	8	prayer			the Brāhmanical caste as a body	Mantra used as a spell; a sacred text; a text; the sacred syllable Om; the sacred word; utterance
brahman	brahma/n	praatipadika	8	a particular Kalpa			as the first of the triad of personal gods	the one impersonal universal Spirit manifested as a personal Creator
brahman	bra/hman	praatipadika	9	religious			the Brahmă; the Brāhmaṇa portion of the Veda; the Veda; the sacred syllable Om	wealth
brahman	brahma/n	praatipadika	9	a particular astronomy Yoga			spells	the sun
brahman	bra/hman	praatipadika	10	spiritual knowledge			the class of men who are the repositories	
brahman	brahma/n	praatipadika	10	as the first of the triad of personal gods			the intellect	
brahman	bra/hman	praatipadika	11	the Brahmă			a sacred text; communicators of sacred knowledge; holy life; religious; the sacred word	
brahman	brahma/n	praatipadika	11	one of the 4 principal priests			the one impersonal universal Spirit manifested as a personal Creator	
brahman	bra/hman	praatipadika	12	the Brāhmanical caste as a body			utterance	
brahman	brahma/n	praatipadika	12	one versed in sacred knowledge			the sun	
brahman	bra/hman	praatipadika	13	the Brāhmaṇa portion of the Veda			wealth	
brahman	brahma/n	praatipadika	13	spells			Brahmā; Name of Bṛhas-pati; Name of Śiva; the Veda; Ṛtvijas	
brahman	bra/hman	praatipadika	14	the Absolute; the Eternal				
brahman	brahma/n	praatipadika	14	the Veda				
brahman	bra/hman	praatipadika	15	the Self-existent				
brahman	brahma/n	praatipadika	15	the intellect				
brahman	bra/hman	praatipadika	16	the Veda				
brahman	brahma/n	praatipadika	16	the one impersonal universal Spirit manifested as a personal Creator				
brahman	bra/hman	praatipadika	17	the class of men who are the repositories				
brahman	brahma/n	praatipadika	17	the sun				
brahman	bra/hman	praatipadika	18	holy life; the sacred syllable Om; the sacred word				
brahman	brahma/n	praatipadika	18	δ Aurigae				
brahman	bra/hman	praatipadika	19	utterance				
brahman	brahma/n	praatipadika	19	Ṛtvijas				
brahman	bra/hman	praatipadika	20	wealth				
citra	citra	praatipadika	0	fro	fro	fro	fro	fro
citra	citra/	praatipadika	0	Jonesia Aśoka	Jonesia Aśoka; Name of a Draviḍa king; Name of a Gandharva; Name of a Jābāla-gṛhapati; Name of a king; Name of a son of Dhṛtarāṣṭra; Plumbago zeylanica	Jonesia Aśoka	Jonesia Aśoka	Jonesia Aśoka
citra	citra	praatipadika	1	leaping to	leaping to	leaping to	leaping to	leaping to
citra	citra/	praatipadika	1	Name of a Draviḍa king; Name of a king; Name of a son of Dhṛtarāṣṭra	Ricinus communis	Name of a Draviḍa king; Name of a Gandharva; Name of a Jābāla-gṛhapati; Name of a king; Name of a son of Dhṛtarāṣṭra; a form of Yama; a sectarial mark on the forehead	Name of a Draviḍa king; Name of a Gandharva; Name of a Jābāla-gṛhapati; Name of a king; Name of a son of Dhṛtarāṣṭra	Name of a Draviḍa king; Name of a Gandharva; Name of a Jābāla-gṛhapati; Name of a king; Name of a son of Dhṛtarāṣṭra
citra	citra/	praatipadika	2	Name of a Gandharva	a bright; a forestof variegated appearance  on; anything bright; bright; bright-coloured; coloured which strikes the eyes; having different varieties; speckled; variegated; variety of colour	a forestof variegated appearance  on; clear; delineation; distinguished; manifold; speckled; variegated	Plumbago zeylanica; Ricinus communis	Ricinus communis
citra	citra/	praatipadika	3	Name of a Jābāla-gṛhapati	a form of Yama	arranging verses in the shape of mathematical	a forestof variegated appearance  on; curious; different; having different varieties; strange; strange!; variegated; variety of colour; various	a sectarial mark on the forehead
citra	citra/	praatipadika	4	Plumbago zeylanica	arranging verses in the shape of mathematical	a picture; a spot; conspicuous; other fanciful figures; sketch; spotted	a form of Yama	containing the word
citra	citra/	praatipadika	5	Ricinus communis	containing the word	containing the word; facetious conversation; punning in the form of question	a sectarial mark on the forehead	Plumbago zeylanica; arranging verses in the shape of mathematical; different; having different varieties; variegated; variety of colour; various; various modes of writing
citra	citra/	praatipadika	6	a brilliant ornament	a picture; a spot; answer; clear; sketch	the ether	a bright; a brilliant ornament; a picture; a spot; anything bright; bright-coloured; coloured which strikes the eyes; ornament; speckled; spotted	a brilliant ornament; a forestof variegated appearance  on; a form of Yama; delineation; manifold; ornament; sketch; the ether
citra	citra/	praatipadika	7	a forestof variegated appearance  on	facetious conversation	a bright; a brilliant ornament; anything bright; bright; bright-coloured; coloured which strikes the eyes; excellent; extraordinary appearance; variety of colour; wonderful	agitated	other fanciful figures
citra	citra/	praatipadika	8	a form of Yama	manifold	various modes of writing	arranging verses in the shape of mathematical	agitated; answer; conspicuous; curious; distinguished; extraordinary appearance; facetious conversation; punning in the form of question; riddle; speckled; spotted; strange; strange!; wonder
citra	citra/	praatipadika	9	a picture	a brilliant ornament; a sectarial mark on the forehead; agitated; conspicuous; delineation; distinguished; extraordinary appearance; ornament; other fanciful figures; spotted	Plumbago zeylanica; Ricinus communis; agitated; answer; curious; different; having different varieties; ornament; riddle; sky; strange; strange!; various; wonder	containing the word	a bright; a picture; a spot; anything bright; bright; bright-coloured; clear; coloured which strikes the eyes; excellent; sky; wonderful
citra	citra/	praatipadika	10	a sectarial mark on the forehead	curious; different; punning in the form of question; riddle; strange; strange!; various; wonder		delineation	
citra	citra/	praatipadika	11	a spot	sky; the ether		answer; bright; clear; conspicuous; distinguished; excellent; wonder; wonderful	
citra	citra/	praatipadika	12	agitated	various modes of writing		extraordinary appearance	
citra	citra/	praatipadika	13	answer	excellent; wonderful		facetious conversation	
citra	citra/	praatipadika	14	arranging verses in the shape of mathematical			manifold	
citra	citra/	praatipadika	15	a bright; anything bright; bright; bright-coloured; clear; conspicuous; speckled; spotted			other fanciful figures	
citra	citra/	praatipadika	16	coloured which strikes the eyes			punning in the form of question	
citra	citra/	praatipadika	17	containing the word			riddle	
citra	citra/	praatipadika	18	extraordinary appearance			sketch	
citra	citra/	praatipadika	19	facetious conversation			sky	
citra	citra/	praatipadika	20	ornament			the ether	
citra	citra/	praatipadika	21	other fanciful figures			various modes of writing	
citra	citra/	praatipadika	22	punning in the form of question				
citra	citra/	praatipadika	23	delineation; sketch				
citra	citra/	praatipadika	24	sky				
citra	citra/	praatipadika	25	the ether				
citra	citra/	praatipadika	26	different; having different varieties; manifold; variegated; variety of colour; various				
citra	citra/	praatipadika	27	various modes of writing				
citra	citra/	praatipadika	28	curious; distinguished; excellent; riddle; strange; strange!; wonder; wonderful				
dfS	df/S	praatipadika	0	appearance; look; looking at; seeing; sight; the eye; view; viewing	doctrine; theory	discerning; doctrine; knowing; the aspect of a planet; theory	discerning; knowing; looking at; seeing; the observed spot	appearance; look; looking at; seeing; sight; the eye; the observed spot; view; viewing
dfS	dfS	praatipadika	0	compose	appear; be seen; become visible; behold; manifested; regard; to; to be always visible; to be seen; to be shown; to cause to see; to notice; to produce or pay; to see by divine intuition; to show a thing; to show or prove; to wish to see; to wish to show	be seen; become visible; demonstrate; long for; manifested; to be always visible; to be seen; to be shown; to cause to see; to notice; to see; to see by divine intuition; to see with the mind; to show a thing; to show or prove; to wait on; to wish to see; to wish to show	compose	learn
dfS	df/S	praatipadika	1	discerning; knowing	the aspect of a planet	appearance; look; looking at; seeing; sight; the eye; the observed spot; view; viewing	doctrine; theory	doctrine; theory
dfS	dfS	praatipadika	1	contrive Aorist	care for	appear; behold; care for; compose; consider; contrive Aorist; examine; find out; learn; look at; look into; person; regard; think; to; try; understand; visit	contrive Aorist	be seen; examine; find out; look into; regard; to be seen; to cause to see; to see; to see by divine intuition; to see with the mind; to wish to see; visit
dfS	df/S	praatipadika	2	doctrine; theory	appearance; look; sight; the eye; the observed spot		the aspect of a planet	discerning; knowing
dfS	dfS	praatipadika	2	appear; demonstrate; manifested; to be shown; to produce or pay; to show a thing; to show or prove; to wish to show	compose; consider; contrive Aorist; demonstrate; examine; find out; learn; look at; look into; think; try; visit	to produce or pay	appear; be seen; behold; manifested; visit	person
dfS	df/S	praatipadika	3	the aspect of a planet	discerning; knowing; looking at; seeing; view; viewing		appearance; look; sight; the eye; view; viewing	the aspect of a planet
dfS	dfS	praatipadika	3	person	person		person	behold; compose; consider; look at; think; to; understand
dfS	df/S	praatipadika	4	the observed spot				
dfS	dfS	praatipadika	4	care for; consider; examine; find out; learn; look at; look into; regard; think; to notice; try; understand	long for; to see; to see with the mind; to wait on; understand		to produce or pay	to produce or pay
dfS	dfS	praatipadika	5	to			become visible; demonstrate; to be always visible; to be seen; to be shown; to cause to see; to see; to see by divine intuition; to see with the mind; to show a thing; to show or prove; to wish to see; to wish to show	appear; become visible; care for; contrive Aorist; demonstrate; manifested; to be always visible; to be shown; to notice; to show a thing; to show or prove; to wish to show
dfS	dfS	praatipadika	6	be seen; become visible; behold; to be always visible; to be seen; to cause to see; to see; to see by divine intuition; to see with the mind; to wish to see; visit			care for; consider; examine; find out; learn; long for; look at; look into; regard; think; to; to notice; to wait on; try; understand	long for; to wait on
dfS	dfS	praatipadika	7	long for; to wait on				try
eka	e/ka	praatipadika	0	Name of a son of Raya	Name of a son of Raya	Name of a son of Raya	Name of a son of Raya	Name of a son of Raya
eka	e/ka	praatipadika	1	Name of a teacher	Name of a teacher	Name of a teacher	Name of a teacher	Name of a teacher
eka	e/ka	praatipadika	2	a; a unit; an; no one; nobody; one; one by one; one of two; unity	a; a unit; an; chief; pre-eminent; unity	alone; happening only once; little; no one; nobody; one; one by one; one of two; single; single of its kind; small; solitary; that one only	a unit; happening only once; one; one by one; single; single of its kind; solitary; that one only; unique	a; an; chief; excellent; following; pre-eminent; sincere; truthful; with preceding
eka	e/ka	praatipadika	3	alone; identical; single; single of its kind; singular; solitary; unique	alone; happening only once; single; single of its kind; singular; solitary; unique	a; a unit; an; chief; excellent; following; identical; many; pre-eminent; sincere; singular; the same; truthful; unique; unity; with preceding	alone; following; little; no one; nobody; singular; small; with preceding	a unit
eka	e/ka	praatipadika	4	chief	following; with preceding		identical; many; one of two; the same	alone; little; no one; nobody; single; single of its kind; singular; small; solitary; unique
eka	e/ka	praatipadika	5	following	no one; nobody		a; an; chief; excellent; pre-eminent; sincere; truthful	happening only once; many; one; one by one; one of two; that one only
eka	e/ka	praatipadika	6	many	many; one; one by one; one of two; that one only		unity	identical; the same
eka	e/ka	praatipadika	7	happening only once; that one only; the same	little; small			unity
eka	e/ka	praatipadika	8	excellent; pre-eminent; with preceding	excellent; identical; sincere; the same; truthful			
eka	e/ka	praatipadika	9	little; small				
eka	e/ka	praatipadika	10	sincere; truthful				
eva	e/va	praatipadika	0	a horse	a horse	a horse	a horse	a horse
eva	eva/	avyaya	0	affirmation	affirmation; command; restrainment	affirmation; alone; command; detraction; diminution; even; is a mere expletive without any exact meaning and not translatable implies emphasis; merely; only; restrainment; same	affirmation	affirmation; command; detraction; diminution; restrainment
eva	e/va	praatipadika	1	conduct; course; custom; habit; manner of acting; way	conduct; manner of acting	going; moving; proceeding; quick; speedy	conduct; course; custom; usage	conduct; custom; habit; manner of acting; usage
eva	eva/	avyaya	1	command	detraction; diminution	already; exactly; exactly so; immediately on; indeed; just; just so; really; so; still; truly; very	command; exactly; exactly so; indeed; only; same; truly	already; even; exactly; exactly so; immediately on; indeed; just so; really; so; truly; very
eva	e/va	praatipadika	2	going; moving; proceeding	custom	conduct; course; custom; habit; manner of acting; the earth; usage; way; world	habit	course; going; moving; proceeding; quick; speedy; way
eva	eva/	avyaya	2	detraction; diminution	is a mere expletive without any exact meaning and not translatable implies emphasis		detraction; diminution; restrainment	is a mere expletive without any exact meaning and not translatable implies emphasis
eva	e/va	praatipadika	3	quick; speedy	course; going; moving; proceeding		manner of acting	the earth; world
eva	eva/	avyaya	3	is a mere expletive without any exact meaning and not translatable implies emphasis	alone; already; even; immediately on; just; merely; only; still; very		alone; already; even; immediately on; just; just so; merely; really; so; still; very	alone; just; merely; only; same; still
eva	e/va	praatipadika	4	the earth; world	habit		going; moving; proceeding; quick; speedy; way	
eva	eva/	avyaya	4	restrainment	same		is a mere expletive without any exact meaning and not translatable implies emphasis	
eva	e/va	praatipadika	5	usage	quick; speedy		the earth; world	
eva	eva/	avyaya	5	alone; already; even; just; just so; merely; only; same; so; still	exactly; exactly so; indeed; just so; really; so; truly			
eva	e/va	praatipadika	6		the earth; world			
eva	eva/	avyaya	6	exactly; exactly so; immediately on; indeed; really; truly; very				
eva	e/va	praatipadika	7		usage			
eva	e/va	praatipadika	8		way			
gam	gam	dhaatu	0	ascribe guilt to a person	be going; bring to a place; come; go away; move; not care about; set out; to go; to go to; to go to any state; to let go; to send away; to spend time; to wish to bring; to wish to go	ascribe guilt to a person; attack; cause to become; kneel down; to approach with an accusation; to cause a person to go by means of another; to cause to go to any condition; to decease; to fall to the share of; to go against with hostile intentions	ascribe guilt to a person	ascribe guilt to a person
gam	gam	dhaatu	1	approach; attack	guess	have sexual intercourse with	approach; attack; come; condition; denote; die; grant; guess; have sexual intercourse with; pass; receive; to approach carnally; to approach with an accusation; to decease; to fall to the share of; to go against with hostile intentions	approach; attack; be going; bring to a place; come; go away; move; set out; to approach carnally; to go; to go to; to go with the mind; to let go; to send away; to wish to go; towards; undergo
gam	gam	dhaatu	2	bring to a place	have sexual intercourse with	make a bow	make a bow	condition; denote; die; explain; grant; guess; make clear; meaning; observe; obtain; partake of; participate in; pass; perceive; receive; to cause to understand; to excel; to observe; to spend time; understand
gam	gam	dhaatu	3	condition	condition; grant; obtain; receive	approach; condition; denote; die; explain; grant; guess; intelligible; make clear; meaning; not care about; observe; obtain; partake of; participate in; perceive; receive; to approach carnally; to cause to understand; to convey an idea; to excel; to impart; to observe; to strive to obtain; towards; undergo; understand	not care about	have sexual intercourse with
gam	gam	dhaatu	4	be going; die; go away; move; set out; to go; to go to; to go with the mind; to let go; to send away; to wish to go; towards	to excel	be going; bring to a place; come; go away; move; pass; set out; to go; to go to; to go to any state; to go to the earth with the head; to go to the earth with the knees; to go with the mind; to let go; to send away; to spend time; to wish to bring; to wish to go	observe; obtain; partake of; participate in; perceive; to observe; undergo	intelligible
gam	gam	dhaatu	5	have sexual intercourse with	approach; ascribe guilt to a person; attack; pass; to approach carnally; to approach with an accusation; to go against with hostile intentions; towards		to excel	make a bow
gam	gam	dhaatu	6	kneel down	die; kneel down; make a bow; to fall to the share of; to go to the earth with the head; to go to the earth with the knees		kneel down; to go to the earth with the head; to go to the earth with the knees	not care about
gam	gam	dhaatu	7	make a bow	cause to become; denote; explain; intelligible; make clear; meaning; observe; partake of; participate in; perceive; to cause a person to go by means of another; to cause to go to any condition; to cause to understand; to convey an idea; to decease; to go with the mind; to impart; to observe; to strive to obtain; undergo; understand		to go with the mind	cause to become; to approach with an accusation; to cause a person to go by means of another; to cause to go to any condition; to convey an idea; to decease; to fall to the share of; to go against with hostile intentions; to go to any state; to impart; to strive to obtain; to wish to bring
gam	gam	dhaatu	8	not care about			cause to become; explain; intelligible; make clear; meaning; to cause a person to go by means of another; to cause to go to any condition; to cause to understand; to convey an idea; to impart; understand	kneel down; to go to the earth with the head; to go to the earth with the knees
gam	gam	dhaatu	9	denote; explain; guess; intelligible; make clear; meaning; observe; perceive; to cause to understand; to observe; understand			be going; bring to a place; go away; move; set out; to go; to go to; to go to any state; to let go; to send away; to spend time; to strive to obtain; to wish to bring; to wish to go; towards	
gam	gam	dhaatu	10	to strive to obtain; to wish to bring				
gam	gam	dhaatu	11	to approach carnally; to approach with an accusation				
gam	gam	dhaatu	12	to cause a person to go by means of another				
gam	gam	dhaatu	13	to convey an idea				
gam	gam	dhaatu	14	to excel				
gam	gam	dhaatu	15	to go against with hostile intentions				
gam	gam	dhaatu	16	to cause to go to any condition; to go to any state				
gam	gam	dhaatu	17	to go to the earth with the head; to go to the earth with the knees				
gam	gam	dhaatu	18	cause to become; come; grant; obtain; partake of; participate in; pass; receive; to decease; to fall to the share of; to impart; undergo				
gam	gam	dhaatu	19	to spend time				
grah	grah	dhaatu	0	draw water	draw water	draw water	draw water	take back; to acquire by purchase; to be about to eclipse; to be about to seize; to be about to take away; to cause to take; to collect a store of anything; to eclipse; to gain; to take for; to take into the mouth; to take on one's self; to take up; win
grah	grah	dhaatu	1	name	grasp; lay hold of; to be about to eclipse; to be about to seize; to be about to take away; to be meant by; to cause any one to be captured; to cause any one to be seized; to cause to take; to collect a store of anything; to eclipse; to include; to lay the hand on; to place upon; to pluck; to take for; to take into the mouth; to take on one's self; to take up; to use	admit; begin; claim; consider as; familiar with; follow; gather; learn; make acquainted; mention; name; observe; recognise; to abstract; to assume; to be meant by; to choose; to desire to perceive; to include; to make any one learn; to obey; to observe; to perceive; to place upon; to receive into the mind; to use; undergo; understand; undertake	give away a girl in marriage to any one; to cause to marry	claim; consider as; mention; name; obtain; to abstract; to assume; to be meant by; to calculate; to choose; to include; to place upon; to use
grah	grah	dhaatu	2	overpowered over to any one	accept; admit; apprehend; approve; begin; claim; consider as; familiar with; follow; gather; keep; make acquainted; mention; name; observe; pick; put on; recognise; seize; take; take away; take back; undergo; undertake; win	apprehend; grasp; keep; lay hold of; overpowered over to any one; put on; seize; strive to apprehend; take; take away; take back; to be about to eclipse; to be about to seize; to be about to take away; to cause any one to be captured; to cause any one to be seized; to cause to take; to eclipse; to lay the hand on; to pluck; to take for; to take into the mouth; to take on one's self; to take up	overpowered over to any one	give away a girl in marriage to any one; learn; overpowered over to any one; to cause any one to be captured; to cause any one to be seized; to cause to marry; to choose any one as a wife; to make any one choose; to make any one learn
grah	grah	dhaatu	3	apprehend; gather; grasp; lay hold of; obtain; pick; seize; take; take away; take back; to abstract; to gain; to pluck; win	overpowered over to any one	give away a girl in marriage to any one; to cause to marry; to choose any one as a wife; to make any one choose	apprehend; grasp; lay hold of; obtain; seize; strive to apprehend; take; take away; take back; to acquire by purchase; to be about to eclipse; to be about to seize; to be about to take away; to calculate; to cause any one to be captured; to cause any one to be seized; to cause to take; to eclipse; to gain; to lay the hand on; to pluck; to take for; to take on one's self; to take up; undertake	accept; admit; apprehend; approve; familiar with; gather; make acquainted; observe; receive; recognise; strive to apprehend; to accept; to desire to perceive; to obey; to observe; to perceive; to receive hospitably; to receive into the mind; understand
